{
  "$schema": "https://json-schema.org/draft/2020-12/schema",
  "$id": "https://valleyofai.com/schemas/meta.json",
  "title": "Valley of AI App Metadata",
  "type": "object",
  "required": [
    "id",
    "name",
    "shortDescription",
    "thumbnail",
    "createdAt",
    "category",
    "status",
    "tags",
    "homepagePath",
    "inputMode",
    "generation"
  ],
  "properties": {
    "id": {
      "type": "string",
      "pattern": "^[a-z0-9]+(?:-[a-z0-9]+)*$",
      "description": "App ID, lowercase kebab-case (e.g. 'snake-game')."
    },
    "name": {
      "type": "string",
      "minLength": 3,
      "maxLength": 80
    },
    "shortDescription": {
      "type": "string",
      "minLength": 10,
      "maxLength": 260,
      "description": "1–2 sentence description of what the app does and why it's interesting."
    },
    "thumbnail": {
      "type": "string",
      "const": "thumbnail.svg",
      "description": "Relative path to thumbnail; currently always 'thumbnail.svg'."
    },
    "createdAt": {
      "type": "string",
      "format": "date-time",
      "description": "UTC timestamp when the app was created, e.g. 2026-03-05T02:30:00Z."
    },
    "category": {
      "type": "string",
      "enum": [
        "Games",
        "Productivity",
        "Utilities",
        "Design",
        "Education",
        "Entertainment",
        "Visualizations",
        "Icebreakers"
      ]
    },
    "visible": {
      "type": "boolean",
      "default": true,
      "description": "Whether this app appears in the public app listing. Defaults to true. Set to false to hide without deleting."
    },
    "allowImprovements": {
      "type": "boolean",
      "default": true,
      "description": "Whether community improvement submissions are accepted for this app. Defaults to true. Set to false to prevent new improvements."
    },
    "status": {
      "type": "string",
      "enum": ["active", "experimental", "retired"],
      "default": "active"
    },
    "tags": {
      "type": "array",
      "items": {
        "type": "string",
        "minLength": 2,
        "maxLength": 30
      },
      "minItems": 2,
      "maxItems": 8,
      "uniqueItems": true
    },
    "homepagePath": {
      "type": "string",
      "const": "index.html",
      "description": "Entry file for the app; currently always 'index.html'."
    },
    "inputMode": {
      "type": "string",
      "enum": ["desktop", "mobile", "responsive"],
      "description": "Dominant input style: desktop (keyboard/mouse), mobile (touch/gestures), or responsive for both."
    },
    "leaderboard": {
      "type": "boolean",
      "default": false,
      "description": "Whether the app implements global leaderboard integration (e.g., submits scores via the shared leaderboard API)."
    },
    "suggestion": {
      "type": "object",
      "description": "GitHub Issue that originated this app, if generated from a user suggestion.",
      "required": ["issueNumber", "issueUrl", "prompt"],
      "properties": {
        "issueNumber": {
          "type": "integer",
          "minimum": 1,
          "description": "GitHub Issue number."
        },
        "issueUrl": {
          "type": "string",
          "description": "Full URL to the GitHub Issue."
        },
        "prompt": {
          "type": "string",
          "minLength": 10,
          "maxLength": 1000,
          "description": "The original suggestion text submitted by the user."
        },
        "requestor": {
          "type": "string",
          "maxLength": 100,
          "description": "GitHub username or display name of the person who submitted the suggestion."
        }
      },
      "additionalProperties": false
    },
    "improvements": {
      "type": "array",
      "description": "Records of improvement pipeline runs applied to this app. Appended by the improvement pipeline — do not set during initial creation.",
      "items": {
        "type": "object",
        "required": [
          "issueNumber",
          "issueUrl",
          "description",
          "implementedAt",
          "agentName",
          "llmModel"
        ],
        "properties": {
          "issueNumber": {
            "type": "integer",
            "minimum": 1,
            "description": "GitHub Issue number for this improvement."
          },
          "issueUrl": {
            "type": "string",
            "description": "Full URL to the GitHub Issue."
          },
          "description": {
            "type": "string",
            "minLength": 10,
            "maxLength": 500,
            "description": "One-sentence summary of what was changed."
          },
          "requestor": {
            "type": "string",
            "maxLength": 100,
            "description": "GitHub username or display name of the person who requested the improvement."
          },
          "implementedAt": {
            "type": "string",
            "format": "date-time",
            "description": "UTC timestamp when the improvement was applied."
          },
          "agentName": {
            "type": "string",
            "minLength": 2,
            "maxLength": 80,
            "description": "Name of the agent that applied the improvement."
          },
          "llmModel": {
            "type": "string",
            "minLength": 2,
            "maxLength": 80,
            "description": "Model identifier used for the improvement."
          }
        },
        "additionalProperties": false
      }
    },
    "generation": {
      "type": "object",
      "required": [
        "agentName",
        "llmModel",
        "startTime",
        "endTime",
        "totalTokensIn",
        "totalTokensOut",
        "runId",
        "notes"
      ],
      "properties": {
        "agentName": {
          "type": "string",
          "minLength": 3,
          "maxLength": 80,
          "description": "Name of the primary agent responsible for generation, e.g. 'openclaw-dev-agent'."
        },
        "llmModel": {
          "type": "string",
          "minLength": 2,
          "maxLength": 80,
          "description": "Model identifier, e.g. 'gpt-5.1'."
        },
        "startTime": {
          "type": "string",
          "format": "date-time",
          "description": "UTC timestamp when generation began."
        },
        "endTime": {
          "type": "string",
          "format": "date-time",
          "description": "UTC timestamp when generation finished."
        },
        "totalTokensIn": {
          "type": "integer",
          "minimum": 0,
          "description": "Total input tokens used for this app generation."
        },
        "totalTokensOut": {
          "type": "integer",
          "minimum": 0,
          "description": "Total output tokens used for this app generation."
        },
        "runId": {
          "type": "string",
          "pattern": "^run-[0-9]{8}T[0-9]{6}Z-[0-9a-fA-F]{6}$",
          "description": "Transaction runId, must match logs for this app."
        },
        "notes": {
          "type": "string",
          "minLength": 0,
          "maxLength": 1000,
          "description": "Brief notes about the generation process or inspiration, including any token estimation caveats."
        }
      },
      "additionalProperties": false
    }
  },
  "additionalProperties": false
}
