{
  "id": "bubble-tap",
  "name": "Bubble Tap",
  "shortDescription": "Tap bubbles as fast as you can in this addictive mobile-first game. Choose your difficulty, rack up combos, and chase high scores with responsive touch controls.",
  "thumbnail": "thumbnail.svg",
  "createdAt": "2026-03-13T00:17:21Z",
  "category": "Games",
  "visible": true,
  "allowImprovements": true,
  "status": "active",
  "tags": ["game", "tap", "mobile", "responsive", "arcade", "high-score", "touch", "reaction"],
  "homepagePath": "index.html",
  "inputMode": "responsive",
  "generation": {
    "agentName": "openclaw-dev-agent",
    "llmModel": "gpt-5.1",
    "startTime": "2026-03-13T00:17:21Z",
    "endTime": "2026-03-13T00:27:15Z",
    "totalTokensIn": 7650,
    "totalTokensOut": 7150,
    "runId": "run-20260313T001721Z-3ba148",
    "notes": "Mobile-first responsive bubble popping game with 3 difficulty levels (Easy/Normal/Hard), touch and click controls, real-time score/combo tracking, particle effects, and local storage for persistent best scores. Fully themed with dark/light mode support and responsive design for all screen sizes."
  },
  "leaderboard": false
}
