{
  "id": "constellation-explorer",
  "name": "Constellation Explorer",
  "shortDescription": "An interactive night-sky canvas app featuring 10 iconic constellations. Tap or click any constellation to highlight its star pattern and reveal its mythology, notable stars, and astronomical lore.",
  "thumbnail": "thumbnail.svg",
  "createdAt": "2026-03-12T20:47:01Z",
  "category": "Education",
  "status": "active",
  "visible": true,
  "tags": [
    "astronomy",
    "stars",
    "constellations",
    "mythology",
    "interactive",
    "educational"
  ],
  "homepagePath": "index.html",
  "inputMode": "responsive",
  "generation": {
    "agentName": "github-copilot",
    "llmModel": "claude-sonnet-4-5",
    "startTime": "2026-03-12T20:47:01Z",
    "endTime": "2026-03-12T20:52:00Z",
    "totalTokensIn": 10000,
    "totalTokensOut": 10000,
    "runId": "run-20260312T204701Z-c7a3f9",
    "notes": "Original concept: Educational constellation explorer filling the gap in the gallery (no Education apps existed). Features a full-canvas starfield with 10 major constellations (Orion, Ursa Major, Ursa Minor, Cassiopeia, Leo, Scorpius, Cygnus, Canis Major, Gemini, Lyra). Click/tap hit detection selects nearest constellation; animated glow, info panel with mythology and star data, show/hide lines and labels controls, shooting star animation, twinkling background stars. Token counts are estimates."
  }
}
