{
  "id": "neon-slot-rush",
  "name": "Neon Slot Rush",
  "shortDescription": "A fast, mobile-first 5x3 neon slot machine with paylines, turbo, and auto-spin.",
  "thumbnail": "thumbnail.svg",
  "createdAt": "2026-03-25T07:00:25Z",
  "category": "Entertainment",
  "status": "active",
  "tags": ["slot-machine", "casino", "rng", "mobile-first", "paylines", "neon"],
  "homepagePath": "index.html",
  "inputMode": "responsive",
  "suggestion": {
    "issueNumber": 198,
    "issueUrl": "https://github.com/jeffholst/valley-of-ai/issues/198",
    "prompt": "Design a modern, highly addictive, mobile-first slot machine with 5x3 reels, paylines, configurable symbols, RNG outcomes, balance/bet/win display, turbo and auto-spin, dark neon theme, and concise paytable/help.",
    "requestor": "Perplexity"
  },
  "improvements": [
    {
      "issueNumber": 202,
      "issueUrl": "https://github.com/jeffholst/valley-of-ai/issues/202",
      "description": "Added per-payline win breakdown list with click-to-highlight: after each spin, each winning payline appears as a clickable row showing symbol, payline number, match count, and payout amount; clicking a row highlights only that payline's cells on the reels.",
      "requestor": "Jeff Holst",
      "implementedAt": "2026-03-25T19:21:37Z",
      "agentName": "Claude Code",
      "llmModel": "claude-sonnet-4-6"
    },
    {
      "issueNumber": 205,
      "issueUrl": "https://github.com/jeffholst/valley-of-ai/issues/205",
      "description": "Added toggleable visual payline overlay: a Lines On/Off button draws all 10 paylines as colored SVG polylines over the reels using getBoundingClientRect positioning; each payline has a distinct neon color and numbered label. Also enhanced the paytable with a formula header (Win = Multiplier x Matches x (Bet / $5)) and a per-symbol grid showing dollar payouts at x3, x4, and x5 matches.",
      "requestor": "Jeff Holst",
      "implementedAt": "2026-03-25T20:49:00Z",
      "agentName": "Claude Code",
      "llmModel": "claude-sonnet-4-6"
    },
    {
      "issueNumber": 207,
      "issueUrl": "https://github.com/jeffholst/valley-of-ai/issues/207",
      "description": "Changed the Lines toggle to cycle through individual paylines (Line 1–Line 10), All Lines, and Off, so each payline can be viewed in isolation to follow a winning line.",
      "requestor": "Jeff Holst",
      "implementedAt": "2026-03-25T21:07:49Z",
      "agentName": "Claude Code",
      "llmModel": "claude-sonnet-4-6"
    }
  ],
  "generation": {
    "agentName": "dev",
    "llmModel": "openai-codex/gpt-5.3-codex",
    "startTime": "2026-03-25T07:00:25Z",
    "endTime": "2026-03-25T07:02:45Z",
    "totalTokensIn": 0,
    "totalTokensOut": 0,
    "runId": "run-20260325T070025Z-5460ff",
    "notes": "Built from approved community suggestion issue #198; optimized for 320px portrait and keyboard/touch parity."
  }
}
