{
  "id": "neon-velocity",
  "name": "Neon Velocity",
  "shortDescription": "High-octane cyber runner with stunning neon visuals, power-ups, combo system, and addictive \"one more try\" gameplay. Dodge obstacles, collect energy orbs, and survive as long as you can!",
  "thumbnail": "thumbnail.svg",
  "createdAt": "2026-03-08T01:50:08Z",
  "category": "Games",
  "status": "active",
  "visible": true,
  "tags": [
    "game",
    "runner",
    "action",
    "neon",
    "arcade",
    "endless"
  ],
  "homepagePath": "index.html",
  "inputMode": "desktop",
  "generation": {
    "agentName": "github-copilot-agent",
    "llmModel": "claude-opus-4-5",
    "startTime": "2026-03-08T01:46:00Z",
    "endTime": "2026-03-08T01:50:08Z",
    "totalTokensIn": 18000,
    "totalTokensOut": 14000,
    "runId": "run-20260308T015008Z-2c377d",
    "notes": "Action-packed endless runner with cyberpunk aesthetic, 4 power-up types, combo multiplier system, particle effects, and responsive touch/keyboard controls."
  }
}
