{
  "id": "timezone-overlap-finder",
  "name": "Timezone Overlap Finder",
  "shortDescription": "Find the best shared meeting windows across global teams by comparing local clocks, work-hour ranges, and a live 24-hour overlap timeline.",
  "thumbnail": "thumbnail.svg",
  "createdAt": "2026-03-12T23:37:33Z",
  "category": "Utilities",
  "visible": true,
  "allowImprovements": true,
  "status": "active",
  "tags": ["timezone", "scheduling", "meeting-planner", "global-teams", "productivity"],
  "homepagePath": "index.html",
  "inputMode": "responsive",
  "generation": {
    "agentName": "openclaw-dev-agent",
    "llmModel": "gpt-5.3-codex",
    "startTime": "2026-03-12T23:37:33Z",
    "endTime": "2026-03-12T23:46:20Z",
    "totalTokensIn": 7200,
    "totalTokensOut": 6800,
    "runId": "run-20260312T233733Z-5e2c9a",
    "notes": "Built a utility app to compare three timezone schedules with work-hour sliders, real-time local clocks, and a UTC overlap timeline. Token counts are estimated from generation phases."
  }
}
