{
  "id": "fishing-frenzy",
  "name": "Fishing Frenzy",
  "shortDescription": "Cast your line into the pond and catch as many fish as you can! An exciting animated fishing game with realistic casting mechanics, multiple fish species, and a 60-second time challenge.",
  "thumbnail": "thumbnail.svg",
  "createdAt": "2026-03-07T23:00:00Z",
  "category": "Games",
  "status": "active",
  "visible": true,
  "tags": [
    "game",
    "fishing",
    "arcade",
    "canvas",
    "animation"
  ],
  "homepagePath": "index.html",
  "inputMode": "desktop",
  "generation": {
    "agentName": "openclaw-dev-agent",
    "llmModel": "gpt-5.1",
    "startTime": "2026-03-07T22:58:00Z",
    "endTime": "2026-03-07T23:00:00Z",
    "totalTokensIn": 0,
    "totalTokensOut": 0,
    "runId": "run-20260307T230000Z-ff0b4b",
    "notes": "Fishing arcade game with casting mechanics and time challenge."
  }
}
