{
  "id": "debug-rush",
  "name": "Debug Rush",
  "shortDescription": "Race against the clock to find bugs in code snippets! Test your debugging skills with syntax errors, logic bugs, and common programming mistakes across JavaScript and Python.",
  "thumbnail": "thumbnail.svg",
  "createdAt": "2026-03-07T19:45:00Z",
  "category": "Games",
  "status": "active",
  "visible": true,
  "tags": [
    "game",
    "debugging",
    "coding",
    "programming",
    "education"
  ],
  "homepagePath": "index.html",
  "inputMode": "desktop",
  "generation": {
    "agentName": "copilot-claude-agent",
    "llmModel": "claude-opus-4-5",
    "startTime": "2026-03-07T19:40:00Z",
    "endTime": "2026-03-07T19:45:00Z",
    "totalTokensIn": 8500,
    "totalTokensOut": 12000,
    "runId": "run-20260307T194000Z-d3b9f1",
    "notes": "Inspired by computer programmers debugging code as quickly as possible. Features 20 real-world coding bugs across JavaScript and Python with syntax highlighting and time pressure."
  }
}
