{
  "id": "spectral-pellet-chase",
  "name": "Spectral Pellet Chase",
  "shortDescription": "A mobile-first, retro maze-chase game with four distinct ghost personalities, responsive touch controls, and full win/loss/restart flow.",
  "thumbnail": "thumbnail.svg",
  "createdAt": "2026-04-10T13:45:58Z",
  "category": "Games",
  "status": "active",
  "tags": ["arcade", "maze", "canvas", "mobile-first", "touch-controls", "retro", "ghost-ai"],
  "homepagePath": "index.html",
  "inputMode": "responsive",
  "visible": false,
  "generation": {
    "agentName": "GitHub Copilot",
    "llmModel": "GPT-5.3-Codex",
    "startTime": "2026-04-10T13:45:58Z",
    "endTime": "2026-04-10T13:51:10Z",
    "totalTokensIn": 10900,
    "totalTokensOut": 6100,
    "runId": "run-20260410T134558Z-2efd52",
    "notes": "Built a shell-safe Pac-Man-inspired maze game with differentiated ghost targeting logic and mobile touch controls."
  },
  "suggestion": {
    "issueNumber": 301,
    "issueUrl": "https://github.com/jeffholst/valley-of-ai/issues/301",
    "prompt": "## App Suggestion\n\n**Category:** Games\n**Requestor:** Jeff Holst\n\n### Description\n\nBuild a mobile\\-first Pac\\-Man\\-inspired browser game using plain JavaScript and HTML5 Canvas in a single self\\-contained HTML file with embedded CSS and JS\\. Include a tile\\-based maze, walls, pellets, score, lives, start screen, game over, restart, and win state\\. The player must move smoothly on the grid and collect all pellets to clear the level\\. Add 4 ghosts with simple but distinct chase behavior; they cannot be purely random\\. Include proper collision detection, responsive canvas sizing, portrait\\-friendly layout, keyboard controls, and touch controls for phones\\. Keep visuals retro and simple using Canvas shapes only—no external assets or libraries\\. Code should be modular, clean, and fully playable, with separated logic for state, rendering, input, and enemy behavior\\. Prioritize correctness, smooth gameplay, and mobile usability\\.",
    "requestor": "Jeff Holst"
  },
  "leaderboard": false
}
