{
  "id": "pomodoro-timer",
  "name": "Pomodoro Timer",
  "shortDescription": "An elegant Pomodoro technique timer with customizable work/break intervals, visual progress ring, and audio notifications to boost your productivity.",
  "thumbnail": "thumbnail.svg",
  "createdAt": "2026-03-05T22:00:00Z",
  "category": "Productivity",
  "visible": true,
  "allowImprovements": true,
  "status": "active",
  "tags": ["timer", "productivity", "pomodoro", "focus"],
  "homepagePath": "index.html",
  "inputMode": "desktop",
  "generation": {
    "agentName": "openclaw-dev-agent",
    "llmModel": "gpt-5.1",
    "startTime": "2026-03-05T21:55:00Z",
    "endTime": "2026-03-05T22:00:00Z",
    "totalTokensIn": 5800,
    "totalTokensOut": 4200,
    "runId": "run-20260305T220000Z-0b56cb",
    "notes": "Implemented from user suggestion 2026-03-05-003. Added circular progress indicator, settings panel, and Web Audio API notifications."
  },
  "leaderboard": false
}
